{
  "endpoint": "https://api.hyperliquid.xyz/info",
  "method": "POST",
  "request_body": {
    "type": "settledOutcome",
    "outcome": 3467
  },
  "requested_at": "2026-09-18T07:21:01.022721+00:00",
  "retrieved_at": "2026-09-18T07:21:01.401699+00:00",
  "http_status": 200,
  "response_file": "settled-3467.json",
  "response_sha256": "d2f94352ba53486cac9b7956f5940ee845a56dc96e02634e02bb1129d3b36b56",
  "server_date": "Fri, 18 Sep 2026 07:21:01 GMT"
}
