{
  "endpoint": "https://api.hyperliquid.xyz/info",
  "method": "POST",
  "request_body": {
    "type": "outcomeMeta"
  },
  "requested_at": "2026-09-18T07:17:10.360882+00:00",
  "retrieved_at": "2026-09-18T07:17:11.073898+00:00",
  "http_status": 200,
  "response_file": "outcome-meta.json",
  "response_sha256": "a1692390028fdbfa2f81df15768431347fab42faa8add5e96b24a8813e9f99ac",
  "server_date": "Fri, 18 Sep 2026 07:17:10 GMT"
}
