{
  "endpoint": "https://api.hyperliquid.xyz/info",
  "method": "POST",
  "request_body": {
    "type": "l2Book",
    "coin": "#39720"
  },
  "requested_at": "2026-09-18T07:17:20.679921+00:00",
  "retrieved_at": "2026-09-18T07:17:21.040781+00:00",
  "http_status": 200,
  "response_file": "book-bucket1-3972-yes.json",
  "response_sha256": "bf6264ecbef4d0e6f7feb52cdd8de4bba636594ce4b1fad1fc1fc90d3825f76b",
  "server_date": "Fri, 18 Sep 2026 07:17:21 GMT"
}
